{
  "event_id": "ffffffff-ffff-4fff-8fff-ffffffffffff",
  "stream_seq": 1,
  "schema_version": 1,
  "event_type": "session.message_queued",
  "project_id": "22222222-2222-4222-8222-222222222222",
  "activity_id": "33333333-3333-4333-8333-333333333333",
  "session_id": "aaaaaaaa-aaaa-4aaa-8aaa-aaaaaaaaaaaa",
  "workbench_id": "canvas",
  "correlation_id": "44444444-4444-4444-8444-444444444444",
  "causation_id": "aaaaaaaa-aaaa-4aaa-8aaa-aaaaaaaaaa02",
  "recorded_at": "2026-08-11T00:00:00Z",
  "variant_id": null,
  "base_revision_id": null,
  "payload": {
    "message_id": "cccccccc-cccc-4ccc-8ccc-cccccccccccc",
    "recipient_session_id": "bbbbbbbb-bbbb-4bbb-8bbb-bbbbbbbbbbbb",
    "message_kind": "send",
    "artifact_id": "dddddddd-dddd-4ddd-8ddd-dddddddddddd",
    "artifact_sha256": "aaaaaaaaaaaaaaaaaaaaaaaaaaaaaaaaaaaaaaaaaaaaaaaaaaaaaaaaaaaaaaaa",
    "state": "queued",
    "receipt_version": 0,
    "reply_to": null,
    "source_refs": []
  }
}
