{
  "event_id": "27272727-2727-4272-8272-272727272727",
  "stream_seq": 8,
  "schema_version": 1,
  "event_type": "formal.run_completed",
  "project_id": "22222222-2222-4222-8222-222222222222",
  "activity_id": "33333333-3333-4333-8333-333333333333",
  "session_id": "pi:session:m3-run",
  "workbench_id": "run-detail",
  "correlation_id": "44444444-4444-4444-8444-444444444444",
  "causation_id": "25252525-2525-4252-8252-252525252525",
  "recorded_at": "2026-08-12T01:03:00+08:00",
  "variant_id": "55555555-5555-4555-8555-555555555555",
  "base_revision_id": "77777777-7777-4777-8777-777777777777",
  "payload": {
    "job_id": "25252525-2525-4252-8252-252525252525",
    "run_spec_id": "17171717-1717-4171-8171-171717171717",
    "run_id": "18181818-1818-4181-8181-181818181818",
    "validation_id": "19191919-1919-4191-8191-191919191919",
    "candidate_revision_id": "77777777-7777-4777-8777-777777777777",
    "run_spec_hash": "ffffffffffffffffffffffffffffffffffffffffffffffffffffffffffffffff",
    "status": "succeeded",
    "gates": {
      "contract": "passed",
      "strategy_import": "passed",
      "smoke_run": "passed"
    },
    "engine_result_artifact_id": "28282828-2828-4282-8282-282828282828",
    "engine_result_sha256": "aaaaaaaaaaaaaaaaaaaaaaaaaaaaaaaaaaaaaaaaaaaaaaaaaaaaaaaaaaaaaaaa",
    "manifest_artifact_id": "29292929-2929-4292-8292-292929292929",
    "manifest_sha256": "bbbbbbbbbbbbbbbbbbbbbbbbbbbbbbbbbbbbbbbbbbbbbbbbbbbbbbbbbbbbbbbb",
    "calculation_hash": "aaaaaaaaaaaaaaaaaaaaaaaaaaaaaaaaaaaaaaaaaaaaaaaaaaaaaaaaaaaaaaaa",
    "error_code": null
  }
}
