{
  "event_id": "17171717-1717-4171-8171-171717171717",
  "stream_seq": 5,
  "schema_version": 1,
  "event_type": "workspace.merge_candidate_created",
  "project_id": "22222222-2222-4222-8222-222222222222",
  "activity_id": "33333333-3333-4333-8333-333333333333",
  "session_id": "pi:session:m3-merge",
  "workbench_id": "code",
  "correlation_id": "44444444-4444-4444-8444-444444444444",
  "causation_id": "16161616-1616-4161-8161-161616161616",
  "recorded_at": "2026-08-12T01:00:00+08:00",
  "variant_id": "55555555-5555-4555-8555-555555555555",
  "base_revision_id": "88888888-8888-4888-8888-888888888888",
  "payload": {
    "candidate_revision_id": "77777777-7777-4777-8777-777777777777",
    "project_parent_revision_id": "66666666-6666-4666-8666-666666666666",
    "variant_parent_revision_id": "88888888-8888-4888-8888-888888888888",
    "git_commit_oid": "cccccccccccccccccccccccccccccccccccccccc",
    "git_tree_oid": "dddddddddddddddddddddddddddddddddddddddd",
    "file_count": 1
  }
}
