{
  "event_id": "abababab-abab-4bab-8bab-abababababab",
  "stream_seq": 2,
  "schema_version": 1,
  "event_type": "artifact.verification_started",
  "project_id": "22222222-2222-4222-8222-222222222222",
  "activity_id": "33333333-3333-4333-8333-333333333333",
  "session_id": "pi:session:m1-a",
  "workbench_id": "canvas",
  "correlation_id": "44444444-4444-4444-8444-444444444444",
  "causation_id": "eeeeeeee-eeee-4eee-8eee-eeeeeeeeeeee",
  "recorded_at": "2026-08-11T19:00:30+08:00",
  "variant_id": null,
  "base_revision_id": null,
  "payload": {
    "artifact_id": "99999999-9999-4999-8999-999999999999",
    "job_id": "eeeeeeee-eeee-4eee-8eee-eeeeeeeeeeee",
    "result": null,
    "error_code": null
  }
}
