{
  "event_id": "ffffffff-ffff-4fff-8fff-fffffffffff6",
  "stream_seq": 6,
  "schema_version": 1,
  "event_type": "session.workbench_bound",
  "project_id": "22222222-2222-4222-8222-222222222222",
  "activity_id": "33333333-3333-4333-8333-333333333333",
  "session_id": "aaaaaaaa-aaaa-4aaa-8aaa-aaaaaaaaaaaa",
  "workbench_id": "code",
  "correlation_id": "44444444-4444-4444-8444-444444444444",
  "causation_id": "aaaaaaaa-aaaa-4aaa-8aaa-aaaaaaaaaa06",
  "recorded_at": "2026-08-11T00:00:00Z",
  "variant_id": null,
  "base_revision_id": null,
  "payload": {
    "session_id": "aaaaaaaa-aaaa-4aaa-8aaa-aaaaaaaaaaaa",
    "workbench_id": "code"
  }
}
