{
  "event_id": "77777777-7777-4777-8777-777777777777",
  "stream_seq": 1,
  "schema_version": 1,
  "event_type": "strategy.variant_created",
  "project_id": "22222222-2222-4222-8222-222222222222",
  "activity_id": "33333333-3333-4333-8333-333333333333",
  "session_id": "pi:session:m0-a",
  "workbench_id": "canvas",
  "correlation_id": "44444444-4444-4444-8444-444444444444",
  "causation_id": "11111111-1111-4111-8111-111111111111",
  "recorded_at": "2026-08-11T19:00:00+08:00",
  "variant_id": "55555555-5555-4555-8555-555555555555",
  "base_revision_id": "66666666-6666-4666-8666-666666666666",
  "payload": {
    "variant_id": "55555555-5555-4555-8555-555555555555",
    "revision_id": "66666666-6666-4666-8666-666666666666"
  }
}
