{
  "event_id": "24242424-2424-4242-8242-242424242424",
  "stream_seq": 6,
  "schema_version": 1,
  "event_type": "formal.run_queued",
  "project_id": "22222222-2222-4222-8222-222222222222",
  "activity_id": "33333333-3333-4333-8333-333333333333",
  "session_id": "pi:session:m3-run",
  "workbench_id": "run-detail",
  "correlation_id": "44444444-4444-4444-8444-444444444444",
  "causation_id": "20202020-2020-4020-8020-202020202020",
  "recorded_at": "2026-08-12T01:01:00+08:00",
  "variant_id": "55555555-5555-4555-8555-555555555555",
  "base_revision_id": "77777777-7777-4777-8777-777777777777",
  "payload": {
    "job_id": "25252525-2525-4252-8252-252525252525",
    "run_spec_id": "17171717-1717-4171-8171-171717171717",
    "run_id": "18181818-1818-4181-8181-181818181818",
    "validation_id": "19191919-1919-4191-8191-191919191919",
    "candidate_revision_id": "77777777-7777-4777-8777-777777777777",
    "run_spec_hash": "ffffffffffffffffffffffffffffffffffffffffffffffffffffffffffffffff"
  }
}
